{
  "$schema": "https://modellang.dev/schemas/capability-manifest.schema.json",
  "capabilityManifestVersion": 6,
  "operationManifestVersion": 7,
  "model": {
    "id": "model:Procurement",
    "name": "Procurement",
    "version": "0.32.0",
    "sourceHash": "sha256:f88b6d6270a9e5d6cb6a4b49979477d8e58cc060d0b423099f1dc1695653960f"
  },
  "view": {
    "audience": "application",
    "safeProjection": true,
    "containsExpressions": false,
    "containsCurrentState": false,
    "grantsAuthority": false
  },
  "authentication": {
    "required": true,
    "callerInput": false
  },
  "actions": [
    {
      "operationId": "action:act_1e35db0451b1461e941af6283d86dca2",
      "inputParameterIds": [
        "parameter:action:act_1e35db0451b1461e941af6283d86dca2.amount"
      ],
      "outcomes": [
        "applicable",
        "denied",
        "notApplicable",
        "stale"
      ],
      "explanation": {
        "safe": true,
        "authorizationRuleId": "authorize:action:act_1e35db0451b1461e941af6283d86dca2",
        "preconditionRuleIds": [
          "require:action:act_1e35db0451b1461e941af6283d86dca2.positive_amount"
        ],
        "revisionRuleId": "revision:action:act_1e35db0451b1461e941af6283d86dca2"
      },
      "revision": {
        "kind": "opaque",
        "staleRequiresExpectedRevision": true,
        "grantsAuthority": false
      },
      "reliability": {
        "idempotency": "required",
        "scope": "authenticatedPrincipal",
        "grantsAuthority": false
      },
      "emittedEventIds": [
        "event:evt_10d694c9a0a274dc79c6168e47d25968"
      ]
    },
    {
      "operationId": "action:act_ed2374e822704c51a2925338253d05d2",
      "inputParameterIds": [
        "parameter:action:act_ed2374e822704c51a2925338253d05d2.request"
      ],
      "outcomes": [
        "applicable",
        "denied",
        "notApplicable",
        "stale"
      ],
      "explanation": {
        "safe": true,
        "authorizationRuleId": "authorize:action:act_ed2374e822704c51a2925338253d05d2",
        "preconditionRuleIds": [
          "require:action:act_ed2374e822704c51a2925338253d05d2.is_draft"
        ],
        "revisionRuleId": "revision:action:act_ed2374e822704c51a2925338253d05d2"
      },
      "revision": {
        "kind": "opaque",
        "staleRequiresExpectedRevision": true,
        "grantsAuthority": false
      },
      "reliability": {
        "idempotency": "unsupported",
        "scope": "authenticatedPrincipal",
        "grantsAuthority": false
      },
      "emittedEventIds": [
        "event:evt_20d694c9a0a274dc79c6168e47d25968"
      ]
    },
    {
      "operationId": "action:act_d39dbb883b5f4019b9027b85add3de47",
      "inputParameterIds": [
        "parameter:action:act_d39dbb883b5f4019b9027b85add3de47.request"
      ],
      "outcomes": [
        "applicable",
        "denied",
        "notApplicable",
        "stale"
      ],
      "explanation": {
        "safe": true,
        "authorizationRuleId": "authorize:action:act_d39dbb883b5f4019b9027b85add3de47",
        "preconditionRuleIds": [
          "require:action:act_d39dbb883b5f4019b9027b85add3de47.is_submitted"
        ],
        "revisionRuleId": "revision:action:act_d39dbb883b5f4019b9027b85add3de47"
      },
      "revision": {
        "kind": "opaque",
        "staleRequiresExpectedRevision": true,
        "grantsAuthority": false
      },
      "reliability": {
        "idempotency": "unsupported",
        "scope": "authenticatedPrincipal",
        "grantsAuthority": false
      },
      "emittedEventIds": [
        "event:evt_30d694c9a0a274dc79c6168e47d25968"
      ]
    }
  ]
}
